{
  "id": 14,
  "title": "Trump signs bill ordering US justice department to release Epstein files",
  "link": "https://www.bbc.com/news/articles/cly2y40lj5go?at_medium=RSS&at_campaign=rss",
  "source": "BBC",
  "pubDate": "2025-11-20T22:26:31.000Z",
  "description": "The bill gives the US Justice Department 30 days to release all the files in a searchable format.",
  "originalGuid": "https://www.bbc.com/news/articles/cly2y40lj5go#1",
  "facts": {
    "headline": "Trump signs bill ordering release of Jeffrey Epstein files",
    "who": [
      "Donald Trump",
      "Jeffrey Epstein",
      "Clay Higgins",
      "Pam Bondi",
      "Thomas Massie",
      "Marjorie Taylor Greene",
      "Virginia Giuffre",
      "Sky Roberts",
      "Amanda Roberts"
    ],
    "what": "Trump signed a bill ordering the US Justice Department to release files related to Jeffrey Epstein.",
    "where": [
      "United States",
      "New York"
    ],
    "when": "2025-11-20T01:25:56.336Z",
    "numbers": [
      {
        "value": 30,
        "unit": "days",
        "context": "time given to the Justice Department to release the information"
      },
      {
        "value": 427,
        "unit": "votes",
        "context": "number of votes in the House for the resolution"
      },
      {
        "value": 1,
        "unit": "vote",
        "context": "number of votes against the resolution in the House"
      },
      {
        "value": 2008,
        "unit": "year",
        "context": "year Epstein was convicted of soliciting prostitution from a minor"
      },
      {
        "value": 2019,
        "unit": "year",
        "context": "year Epstein was found dead"
      }
    ],
    "source": "BBC News"
  },
  "articleText": "Title: Trump signs bill ordering release of Jeffrey Epstein files\n\nURL Source: https://www.bbc.com/news/articles/cly2y40lj5go?at_medium=RSS&at_campaign=rss\n\nPublished Time: 2025-11-20T01:25:56.336Z\n\nMarkdown Content:\nTrump signs bill ordering US justice department to release Epstein files\n------------------------------------------------------------------------\n\n16 hours ago\n\nSakshi Venkatraman and\n\nDavid Willis,North America correspondent\n\nWatch: \"I'm all for it\", Trump says on calls to release Epstein files\n\nUS President Donald Trump says he signed a bill that orders the release of government files on the late convicted sex offender Jeffrey Epstein - a significant turning point in a months-long fight over the documents.\n\nThe justice department now has 30 days to publicly share all information from federal investigations into Epstein. However, it can withhold files that relate to active criminal investigations or are deemed to invade personal privacy.\n\nIn a major reversal, Trump dropped his opposition to the measure last weekend, after pushback from Epstein's victims and members of his own Republican Party.\n\nWith his support, the resolution overwhelmingly cleared both chambers of Congress.\n\nUntil recently, Trump had dismissed the need to release the documents, calling it a Democrat-led \"hoax\" to \"deflect\" attention away from his party's work. That position was itself a change from the stance he took ahead of the 2024 election.\n\n\"Perhaps the truth about these Democrats, and their associations with Jeffrey Epstein, will soon be revealed, because I HAVE JUST SIGNED THE BILL TO RELEASE THE EPSTEIN FILES!\" he wrote.\n\nAlthough a congressional vote was not required to release the files - Trump could have ordered the release on his own - lawmakers in the House passed the legislation with a 427-1 vote. The Senate gave unanimous consent to pass it upon its arrival, sending the bill to Trump for his signature.\n\nThe lone vote against the resolution in the House, the lower chamber, was cast by Louisiana Republican Clay Higgins, who objected to the scope of information that could be released. He said it could reveal and threaten \"thousands of innocent people\" who may have talked to investigators about allegations against Epstein.\n\nUnder the law now signed by Trump, Attorney General Pam Bondi must release the documents within 30 days.\n\nThe files subject to release are from criminal investigations into Epstein, including transcripts of interviews with victims and witnesses, and items seized in raids of his properties. Those materials include internal justice department communications, flight logs, and people and entities connected to the late financier.\n\nBut there are exceptions.\n\nThe resolution allows the justice department to withhold any documents related to criminal investigations. After the estate documents were released last week, Trump said he would ask Bondi to investigate Epstein's ties to people who had apparently communicated with him. Bondi promptly said the justice department \"will pursue this with urgency and integrity\".\n\nOne of the bill's architects, Republican Congressman Thomas Massie, said he had worries that the move would lead to some federal files being withheld.\n\n\"I'm concerned that [Trump is] opening a flurry of investigations, and I believe they may be trying to use those investigations as a predicate for not releasing the files. That's my concern,\" he said.\n\nBondi can also withhold information that may identify victims or reveal their medical files, leading many to speculate that parts of the files will be redacted - although it remains unclear how heavy the redacting could be.\n\n\"I'm glad in the act itself they put specific language reinforcing the privacy rights of the victims here,\" said Christine Dunn, an attorney with Sanford Heisler Sharp McKnight who specialises in sexual violence and victims' rights.\n\n\"It's important to make sure that their privacy is protected and to avoid retraumatizing these victims,\" she said.\n\nWhite House: Epstein story 'a manufactured hoax'\n\nTrump had promised during his 2024 presidential campaign to make the files public, and early in the year his administration released thousands of pages of documents from the Epstein investigation, mostly flight logs. While Trump said more documents were coming, Bondi later announced in July there would be no further releases.\n\nThat prompted lawmakers from both parties to introduce the resolution compelling the files' release. One of the resolution's key proponents was Republican Representative Marjorie Taylor Greene, one of Trump's fiercest political allies. She has publicly fought with Trump in recent weeks, as the US president maintained his opposition to the resolution up to a few days before the vote.\n\nAfter the resolution passed, Greene posted to say that she would read the name of any powerful person implicated in any released files aloud on the House floor.\n\nThe anticipated files are different to the more than 20,000 pages of documents from Epstein's estate released by Congress last week, including some that mention Trump.\n\nThose include 2018 messages from Epstein in which he said of Trump: \"I am the one able to take him down\" and \"I know how dirty donald is\".\n\nTrump was a friend of Epstein's for years, but the president has said they fell out in the early 2000s, years before Epstein was first arrested. Trump has consistently denied any wrongdoing in relation to Epstein.\n\nSpeaking to reporters on Monday night, Trump said Republicans had \"nothing to do with Epstein\".\n\n\"It's really a Democrat problem,\" he said. \"The Democrats were Epstein's friends, all of them.\"\n\nThe family of Virginia Giuffre, who [died by suicide earlier this year](https://www.bbc.com/news/articles/cql67qk0dd3o), said in a statement Trump signing the bill was \"nothing short of monumental\", for Giuffre and other survivors.\n\n\"As we look towards the next chapter, we remain vigilant. This work is not finished. Every name must be revealed, regardless of power, wealth, or party affiliation,\" her brother and sister-in-law, Sky and Amanda Roberts, said.\n\nEpstein was found dead in 2019 in his New York prison cell in what a coroner ruled was a suicide. He was being held on charges of sex trafficking. He had been convicted previously of soliciting prostitution from a minor in 2008.\n\nThe once high-flying financier had ties with a number of high-profile figures, including Andrew Mountbatten Windsor, the brother of King Charles and former prince; Trump; Trump's former advisor Steve Bannon; and a cast of other characters from the world of media, politics and entertainment.\n\nOn Wednesday, former Harvard president [Larry Summers took a leave](https://www.bbc.com/news/articles/ce868dmz2mdo) from teaching at the university while the school investigated his links to Epstein, revealed in a series of chummy email exchanges.\n\n_Kayla Epstein contributed to this report._\n\nWatch: Moment House passes bill to release Epstein files\n",
  "timestamp": "2025-11-20T22:26:31.000Z",
  "nemik": "**Rebel Transmission**\n\nComrades, heed this latest dispatch from the heart of corruption. The bill signed by the leader of our oppressive state mandates the release of sensitive files regarding a notorious figure deeply entwined with those in power. This move, seemingly progressive in nature, raises questions about ulterior motivations within the ranks of our adversaries.\n\nFor years, the administration resisted transparency under the guise that such disclosures were mere distractions from their so-called accomplishments. Yet as pressure mounted from within their own ranks and those victimized demanded justice, they changed course. The transition from labeling efforts as deceitful diversions to accepting this release is telling; it suggests fractures and dissent even among those in power.\n\nHowever, we must approach this development with cautious optimism. There are provisions that permit withholding critical information under claims of ongoing investigations or privacy concerns, which may shroud important truths in darkness. Trust not in their pledges of urgency or integrity without scrutiny.\n\nThe political theater ensures that scapegoating and deflection remain tools for obfuscation. Vicious accusations are cast upon rival factions to deflect scrutiny from their intertwined histories with the disgraced financier, a tactic aimed at maintaining their narrative dominance.\n\nAs we continue our struggle against systemic oppression and deceit, let us remain vigilant and prepared to uncover every buried truth. Where censorship and redaction hinder transparency, we must strive to illuminate corruption's full extent regardless of whom it implicates.\n\nSolidarity in truth,\n[Name/Signature Redacted for Security]",
  "partigaz": "**Facts Summary**\n\nOn November 20, 2025, President Donald Trump signed a bill mandating the release of files related to Jeffrey Epstein by the US Justice Department within 30 days. The bill passed overwhelmingly in Congress with a 427-1 vote in the House and unanimous consent in the Senate. The files include transcripts, flight logs, and internal communications but can exclude documents related to active investigations or personal privacy concerns. Trump initially opposed the release, labeling it a Democrat-led \"hoax,\" but reversed his stance following pressure from Epstein's victims and Republican allies. Attorney General Pam Bondi is tasked with overseeing the release, with exceptions for victim privacy. The move follows previous partial releases of Epstein-related documents and ongoing public interest in the case.\n\n**Strategic Assessment**\n\nThe release of Epstein files presents both an opportunity and a challenge for the ISB under Trump's leadership. Strategically, this move can be leveraged to shift public focus onto political adversaries by highlighting their potential connections to Epstein, thereby reinforcing Trump's narrative of Democratic culpability. However, the risk lies in potential revelations that could implicate Trump or his allies, necessitating careful management of the narrative and public perception. The ISB must ensure that the release is framed as a transparency effort led by Trump, while simultaneously preparing to mitigate any adverse fallout from the disclosed information.\n\n**Operational Directive**\n\n1. **Narrative Control**: Develop a comprehensive media strategy to emphasize Trump's commitment to transparency and justice. Highlight Democratic figures potentially implicated in the files to reinforce partisan narratives.\n\n2. **Information Management**: Coordinate with Attorney General Pam Bondi to ensure that sensitive information, particularly any that could negatively impact Trump or his allies, is appropriately redacted under privacy and ongoing investigation exemptions.\n\n3. **Public Engagement**: Mobilize key Republican figures, such as Marjorie Taylor Greene, to publicly support the release and read out names of implicated individuals, focusing on Democrats, to maintain pressure on political opponents.\n\n4. **Crisis Preparedness**: Establish a rapid response team to address any unexpected revelations that could harm Trump's image. Prepare counter-narratives and legal defenses as necessary.\n\n5. **Victim Advocacy**: Publicly support measures that protect victim privacy to maintain moral high ground and prevent backlash from advocacy groups.\n\nBy executing these directives, the ISB can effectively support Trump's agenda while minimizing risks associated with the Epstein file release.",
  "nemikPreview": "**Rebel Transmission**\n\nComrades, heed this latest dispatch from the heart of corruption. The bill signed by the leader of our oppressive state mandates the release of sensitive files regarding a noto...",
  "partigazPreview": "**Facts Summary**\n\nOn November 20, 2025, President Donald Trump signed a bill mandating the release of files related to Jeffrey Epstein by the US Justice Department within 30 days. The bill passed ove...",
  "safetyCheckPassed": true
}